Nathan,Blecharczyk,Co-Founder & CSO,Airbnb,https://airbnb.com,Marketplace,United States,1000+,https://www.linkedin.com/in/nathanblecharczyk,nathan@airbnb.com,Strategy scaling,CSO managing global strategic operations
Logan,Green,Co-Founder,Lyft,https://lyft.com,Marketplace / Transport,United States,1000+,https://www.linkedin.com/in/logangreen,logan@lyft.com,Rideshare ops,Transportation platform with massive driver ops
John,Zimmer,Co-Founder & President,Lyft,https://lyft.com,Marketplace / Transport,United States,1000+,https://www.linkedin.com/in/johnzimmer,john@lyft.com,Driver expansion,Managing driver operations at scale
Tony,Xu,Co-Founder & CEO,DoorDash,https://doordash.com,Marketplace / Delivery,United States,1000+,https://www.linkedin.com/in/xutony,tony@doordash.com,Delivery scaling,Food delivery platform with massive logistics ops
Andy,Fang,Co-Founder,DoorDash,https://doordash.com,Marketplace / Delivery,United States,1000+,https://www.linkedin.com/in/andyfang1,andy@doordash.com,Tech infrastructure,Co-founder managing delivery tech scaling
Aneel,Bhusri,Co-Founder & CEO,Workday,https://workday.com,HR Tech / Enterprise,United States,1000+,https://www.linkedin.com/in/aneelbhusri,aneel@workday.com,Enterprise HR,HR platform at massive enterprise scale
Aaron,Levie,Co-Founder & CEO,Box,https://box.com,SaaS / Cloud Storage,United States,1000+,https://www.linkedin.com/in/aaronlevie,levie@box.com,Cloud storage,Enterprise content management at scale
Drew,Houston,Co-Founder & CEO,Dropbox,https://dropbox.com,SaaS / Cloud Storage,United States,1000+,https://www.linkedin.com/in/drewhouston,drew@dropbox.com,Cloud productivity,File sharing platform with massive user ops
Arash,Ferdowsi,Co-Founder,Dropbox,https://dropbox.com,SaaS / Cloud Storage,United States,1000+,https://www.linkedin.com/in/arashferdowsi,arash@dropbox.com,Tech scaling,Co-founder managing infrastructure growth
Marcelo,Claure,CEO,SoftBank Group International,https://softbank.com,Venture Capital,United States,1000+,https://www.linkedin.com/in/marceloclaure,marcelo@softbank.com,Portfolio ops,VC portfolio companies need ops support
Frederic,Kerrest,Co-Founder & COO,Okta,https://okta.com,SaaS / Security,United States,1000+,https://www.linkedin.com/in/frederickerrest,frederic@okta.com,Identity security,Identity platform scaling enterprise support
Todd,McKinnon,Co-Founder & CEO,Okta,https://okta.com,SaaS / Security,United States,1000+,https://www.linkedin.com/in/toddmckinnon,todd@okta.com,Zero trust scaling,CEO managing enterprise security expansion
Daniel,Dines,Co-Founder & CEO,UiPath,https://uipath.com,AI / Automation,United States,1000+,https://www.linkedin.com/in/danieldines,daniel@uipath.com,RPA dominance,Robotic process automation at enterprise scale
Krish,Subramanian,Co-Founder & CEO,Chargebee,https://chargebee.com,SaaS / Billing,United States,500-1000,https://www.linkedin.com/in/krishsubramanian,krish@chargebee.com,Billing infrastructure,Subscription billing platform scaling globally
Jason,VandeBoom,Founder & CEO,ActiveCampaign,https://activecampaign.com,SaaS / Marketing,United States,500-1000,https://www.linkedin.com/in/jasonvandeboom,jason@activecampaign.com,CXA platform,Customer experience automation at scale
Mike,Cannon-Brookes,Co-Founder & Co-CEO,Atlassian,https://atlassian.com,SaaS / Dev Tools,Australia,1000+,https://www.linkedin.com/in/mikecannonbrookes,mike@atlassian.com,Dev tool dominance,Enterprise dev tools with massive global ops
Scott,Farquhar,Co-Founder & Co-CEO,Atlassian,https://atlassian.com,SaaS / Dev Tools,Australia,1000+,https://www.linkedin.com/in/scottfarquhar,scott@atlassian.com,Enterprise expansion,Co-CEO managing global enterprise scaling
Olivier,Pomel,Co-Founder & CEO,Datadog,https://datadoghq.com,SaaS / Monitoring,United States,1000+,https://www.linkedin.com/in/olivierpomel,olivier@datadoghq.com,Observability leader,Cloud monitoring platform at massive scale
Alexis,Le-Quoc,Co-Founder & CTO,Datadog,https://datadoghq.com,SaaS / Monitoring,United States,1000+,https://www.linkedin.com/in/alexislequoc,alexis@datadoghq.com,Infrastructure scaling,CTO managing observability infrastructure
Jay,Kreps,Co-Founder & CEO,Confluent,https://confluent.io,Data Infrastructure,United States,1000+,https://www.linkedin.com/in/jaykreps,jay@confluent.io,Data streaming,Kafka platform scaling enterprise data ops
Ali,Ghodsi,Co-Founder & CEO,Databricks,https://databricks.com,AI / Data,United States,1000+,https://www.linkedin.com/in/alighodsi,ali@databricks.com,Data + AI platform,Unified analytics platform at enterprise scale
Tomer,Weingarten,Co-Founder & CEO,SentinelOne,https://sentinelone.com,Cybersecurity,United States,1000+,https://www.linkedin.com/in/tomerweingarten,tomer@sentinelone.com,Endpoint security,AI cybersecurity platform scaling globally
George,Kurtz,Co-Founder & CEO,CrowdStrike,https://crowdstrike.com,Cybersecurity,United States,1000+,https://www.linkedin.com/in/georgekurtz,george@crowdstrike.com,Cybersecurity leader,Enterprise security platform at massive scale
Nikesh,Arora,CEO,Palo Alto Networks,https://paloaltonetworks.com,Cybersecurity,United States,1000+,https://www.linkedin.com/in/nikesharora,nikesh@paloaltonetworks.com,Security dominance,Leading cybersecurity company at global scale
Bipul,Sinha,Co-Founder & CEO,Rubrik,https://rubrik.com,Data Security,United States,1000+,https://www.linkedin.com/in/bipulsinha,bipul@rubrik.com,Data protection,Cloud data management scaling enterprise
Assaf,Rappaport,Co-Founder & CEO,Wiz,https://wiz.io,Cloud Security,United States,500-1000,https://www.linkedin.com/in/assafrappaport,assaf@wiz.io,Fastest SaaS growth,Cloud security startup with record growth
Tom,Preston-Werner,Co-Founder,GitHub,https://github.com,Dev Tools,United States,1000+,https://www.linkedin.com/in/mojombo,tom@github.com,Dev ecosystem,Developer platform co-founder with massive reach
Mitchell,Hashimoto,Co-Founder,HashiCorp,https://hashicorp.com,Dev Tools / Cloud,United States,1000+,https://www.linkedin.com/in/mitchellh,mitchell@hashicorp.com,Infrastructure tooling,Cloud infrastructure tools at enterprise scale
Armon,Dadgar,Co-Founder & CTO,HashiCorp,https://hashicorp.com,Dev Tools / Cloud,United States,1000+,https://www.linkedin.com/in/armondadgar,armon@hashicorp.com,Cloud infrastructure,CTO managing multi-cloud infrastructure tools
Solomon,Hykes,Founder,Docker,https://docker.com,Dev Tools / Cloud,United States,500-1000,https://www.linkedin.com/in/solomonhykes,solomon@docker.com,Container revolution,Container platform that changed dev ops
Edith,Harbaugh,Co-Founder & CEO,LaunchDarkly,https://launchdarkly.com,Dev Tools,United States,500-1000,https://www.linkedin.com/in/edithharbaugh,edith@launchdarkly.com,Feature management,Feature flag platform scaling enterprise
John,Kodumal,Co-Founder & CTO,LaunchDarkly,https://launchdarkly.com,Dev Tools,United States,500-1000,https://www.linkedin.com/in/jkodumal,john@launchdarkly.com,Dev tooling,CTO managing feature management infrastructure
Abhinav,Asthana,Co-Founder & CEO,Postman,https://postman.com,Dev Tools / API,United States,500-1000,https://www.linkedin.com/in/abhinavasthana,abhinav@postman.com,API platform,API development platform with millions of devs
Aparna,Chennapragada,Chief Product Officer,Robinhood,https://robinhood.com,FinTech,United States,1000+,https://www.linkedin.com/in/aparnachennapragada,aparna@robinhood.com,Product scaling,CPO managing product ops at fintech scale
Leah,Busque,Founder,TaskRabbit,https://taskrabbit.com,Marketplace,United States,500-1000,https://www.linkedin.com/in/leahbusque,leah@taskrabbit.com,Gig marketplace,Gig economy platform with massive ops needs
Katrina,Lake,Founder & CEO,Stitch Fix,https://stitchfix.com,E-Commerce / AI,United States,1000+,https://www.linkedin.com/in/katrina-lake,katrina@stitchfix.com,AI styling,AI-driven fashion with massive logistics ops
Whitney,Wolfe Herd,Founder & CEO,Bumble,https://bumble.com,Social / Dating,United States,1000+,https://www.linkedin.com/in/whitneywolfeherd,whitney@bumble.com,Social platform,Dating app scaling global user safety ops
Kevin,Systrom,Co-Founder,Instagram,https://instagram.com,Social,United States,1000+,https://www.linkedin.com/in/kevinsystrom,kevin@instagram.com,Platform pioneer,Social media pioneer with massive network
Mike,Krieger,Co-Founder,Instagram,https://instagram.com,Social,United States,1000+,https://www.linkedin.com/in/mikekrieger,mike@instagram.com,Product scaling,Co-founder of billion-user social platform
Evan,Spiegel,Co-Founder & CEO,Snap,https://snap.com,Social / AR,United States,1000+,https://www.linkedin.com/in/evanspiegel,evan@snap.com,AR innovation,Social media platform scaling AR operations
Bobby,Murphy,Co-Founder & CTO,Snap,https://snap.com,Social / AR,United States,1000+,https://www.linkedin.com/in/bobbymurphy,bobby@snap.com,Tech infrastructure,CTO managing AR and messaging infrastructure
Kevin,Weil,Chief Product Officer,Planet Labs,https://planet.com,Space Tech,United States,500-1000,https://www.linkedin.com/in/kevinweil,kevin@planet.com,Earth imaging,Satellite imaging company scaling data ops
Will,Marshall,Co-Founder & CEO,Planet Labs,https://planet.com,Space Tech,United States,500-1000,https://www.linkedin.com/in/willmarshall,will@planet.com,Space data,CEO managing global satellite operations
Emmett,Shear,CEO,Y Combinator,https://ycombinator.com,Venture Capital,United States,50-200,https://www.linkedin.com/in/emmetshear,emmett@ycombinator.com,Startup ecosystem,Accelerator portfolio companies need ops
Jyoti,Bansal,Founder & CEO,Harness,https://harness.io,Dev Tools / CI-CD,United States,500-1000,https://www.linkedin.com/in/jyotibansal,jyoti@harness.io,DevOps platform,CI/CD platform scaling enterprise deployments
Karan,Bajaj,Founder & CEO,WhiteHat Jr,https://whitehatjr.com,EdTech,United States,500-1000,https://www.linkedin.com/in/karanbajaj,karan@whitehatjr.com,EdTech scaling,Coding education platform with massive tutor ops
Kunal,Shah,Founder & CEO,CRED,https://cred.club,FinTech,Asia,500-1000,https://www.linkedin.com/in/kunalshah1,kunal@cred.club,Fintech growth,Credit card rewards app scaling member ops
Ritesh,Agarwal,Founder & CEO,OYO Rooms,https://oyorooms.com,Hospitality,Asia,1000+,https://www.linkedin.com/in/riteshagarwal,ritesh@oyorooms.com,Hotel scaling,Hotel chain scaling global hospitality ops
Byju,Raveendran,Founder & CEO,BYJU'S,https://byjus.com,EdTech,Asia,1000+,https://www.linkedin.com/in/byju-raveendran,byju@byjus.com,EdTech giant,Education platform with massive content ops
Veer,Gidwaney,Co-Founder,Maxwell Health,https://maxwellhealth.com,HealthTech,United States,100-500,https://www.linkedin.com/in/veergidwaney,veer@maxwellhealth.com,Benefits platform,Health benefits platform scaling employer ops
Adrian,Aoun,Founder & CEO,Forward,https://goforward.com,HealthTech,United States,100-500,https://www.linkedin.com/in/adrianaoun,adrian@goforward.com,AI healthcare,AI-powered healthcare scaling clinic ops
Mario,Schlosser,Co-Founder & CEO,Oscar Health,https://hioscar.com,HealthTech / Insurance,United States,1000+,https://www.linkedin.com/in/marioschlosser,mario@hioscar.com,Health insurance,Tech-driven health insurance scaling operations
Josh,Kushner,Founder,Thrive Capital,https://thrivecap.com,Venture Capital,United States,50-200,https://www.linkedin.com/in/joshkushner,josh@thrivecap.com,Portfolio growth,VC firm portfolio companies need ops support
Elad,Gil,Author & Investor,elad.blog,https://eladgil.com,Venture / Consulting,United States,1-10,https://www.linkedin.com/in/eladgil,elad@eladgil.com,High-growth advisor,Advisor to scaling companies understands ops needs
Naval,Ravikant,Co-Founder,AngelList,https://angel.co,Venture Capital,United States,100-500,https://www.linkedin.com/in/navalravikant,naval@angel.co,Startup infrastructure,Startup funding platform with massive deal ops
Austen,Allred,Co-Founder & CEO,BloomTech,https://bloomtech.com,EdTech,United States,100-500,https://www.linkedin.com/in/austenallred,austen@bloomtech.com,ISA model scaling,Coding bootcamp scaling student support ops
Rachel,Hepworth,VP of Marketing,Slack,https://slack.com,SaaS / Comms,United States,1000+,https://www.linkedin.com/in/rachelhepworth,rachel@slack.com,Marketing ops,VP managing marketing operations at scale
Lloyed,Lobo,Co-Founder,Boast.ai,https://boast.ai,FinTech / AI,Canada,50-200,https://www.linkedin.com/in/lloydlobo,lloyed@boast.ai,R&D tax credits,AI fintech platform scaling customer ops
Qasar,Younis,CEO,Applied Intuition,https://appliedintuition.com,AI / Autonomous,United States,100-500,https://www.linkedin.com/in/qasaryounis,qasar@appliedintuition.com,Autonomous vehicles,AV simulation platform scaling engineering ops
Clara,Shih,CEO,Salesforce AI,https://salesforce.com,AI / Enterprise,United States,1000+,https://www.linkedin.com/in/clarashih,clara@salesforce.com,Enterprise AI,Leading AI division at enterprise scale
Sarah,Friar,CEO,Nextdoor,https://nextdoor.com,Social / Local,United States,500-1000,https://www.linkedin.com/in/sarahfriar,sarah@nextdoor.com,Local social,Neighborhood social platform scaling moderation
Fidji,Simo,CEO,Instacart,https://instacart.com,Marketplace / Delivery,United States,1000+,https://www.linkedin.com/in/fidjisimo,fidji@instacart.com,Grocery delivery,Grocery delivery platform scaling shopper ops
Dara,Khosrowshahi,CEO,Uber,https://uber.com,Marketplace / Transport,United States,1000+,https://www.linkedin.com/in/darakhosrowshahi,dara@uber.com,Global mobility,Ride-sharing platform at massive global scale
Brian,Armstrong,Co-Founder & CEO,Coinbase,https://coinbase.com,FinTech / Crypto,United States,1000+,https://www.linkedin.com/in/barmstrong,brian@coinbase.com,Crypto platform,Crypto exchange scaling compliance and support ops
Emilie,Choi,President & COO,Coinbase,https://coinbase.com,FinTech / Crypto,United States,1000+,https://www.linkedin.com/in/emiliechoi,emilie@coinbase.com,Ops leadership,COO managing crypto exchange operations
Changpeng,Zhao,Founder & CEO,Binance,https://binance.com,FinTech / Crypto,Asia,1000+,https://www.linkedin.com/in/cpzhao,cz@binance.com,Global crypto exchange,Largest crypto exchange with global ops needs
Brad,Garlinghouse,CEO,Ripple,https://ripple.com,FinTech / Crypto,United States,500-1000,https://www.linkedin.com/in/bradgarlinghouse,brad@ripple.com,Blockchain payments,Enterprise blockchain payment network at scale
Mikkel,Dencker Jensen,Co-Founder & CEO,Pleo,https://pleo.io,FinTech,Europe,200-500,https://www.linkedin.com/in/mikkeldj,mikkel@pleo.io,Expense management,Business spending platform scaling in Europe
Valentin,Stalf,Founder & CEO,N26,https://n26.com,FinTech,Europe,1000+,https://www.linkedin.com/in/valentinstalf,valentin@n26.com,Mobile banking EU,European neobank scaling customer ops
Marqeta,Gardiner,CEO,Thought Machine,https://thoughtmachine.net,FinTech / Banking,United Kingdom,500-1000,https://www.linkedin.com/in/paulgardiner,paul@thoughtmachine.net,Core banking,Cloud banking platform scaling globally
Nik,Storonsky,CEO,Revolut,https://revolut.com,FinTech,United Kingdom,1000+,https://www.linkedin.com/in/nikolaystoronsky,nik@revolut.com,Super-app growth,Global fintech super-app scaling ops
Guillaume,Pousaz,Founder & CEO,Checkout.com,https://checkout.com,FinTech / Payments,United Kingdom,1000+,https://www.linkedin.com/in/gpousaz,guillaume@checkout.com,Payment processing,Enterprise payments platform scaling globally
Hiroki,Takeuchi,Co-Founder & CEO,GoCardless,https://gocardless.com,FinTech / Payments,United Kingdom,500-1000,https://www.linkedin.com/in/hirokitakeuchi,hiroki@gocardless.com,Direct debit scaling,Payment processing platform scaling UK/EU ops
Taavet,Hinrikus,Co-Founder,Wise,https://wise.com,FinTech,United Kingdom,1000+,https://www.linkedin.com/in/taavethinrikus,taavet@wise.com,Money transfer,International money transfer at massive scale
Daniel,Mateos,Co-Founder & CEO,Yokoy,https://yokoy.io,FinTech / Automation,Switzerland,100-500,https://www.linkedin.com/in/danielmateos,daniel@yokoy.io,Expense automation,AI expense management scaling in Europe
Lars,Markull,Founder,Salesflow,https://salesflow.io,SaaS / Sales,United Kingdom,10-50,https://www.linkedin.com/in/larsmarkull,lars@salesflow.io,LinkedIn automation,Sales automation tool scaling outbound ops
Manuel,Frigerio,Founder,ReferralHero,https://referralhero.com,SaaS / Growth,Europe,1-10,https://www.linkedin.com/in/manuelfrigerio,manuel@referralhero.com,Referral growth,Referral marketing platform scaling support
Sujan,Patel,Co-Founder,Mailshake,https://mailshake.com,SaaS / Sales,United States,10-50,https://www.linkedin.com/in/sujanpatel,sujan@mailshake.com,Sales outreach,Sales engagement tool scaling customer ops
Ian,Koniak,Founder,Untap Your Sales Potential,https://iankoniak.com,Sales Consulting,United States,1-10,https://www.linkedin.com/in/iankoniak,ian@iankoniak.com,Enterprise sales,Sales consultant scaling coaching ops
Liam,Martin,Co-Founder,Time Doctor,https://timedoctor.com,SaaS / Remote Work,Canada,50-200,https://www.linkedin.com/in/liammartin,liam@timedoctor.com,Remote work tools,Time tracking platform scaling support ops
Rob,Rawson,Co-Founder,Time Doctor,https://timedoctor.com,SaaS / Remote Work,Australia,50-200,https://www.linkedin.com/in/robrawson,rob@timedoctor.com,Distributed teams,Co-founder managing remote team operations
David,Darmanin,Founder & CEO,Hotjar,https://hotjar.com,SaaS / Analytics,Europe,100-500,https://www.linkedin.com/in/daviddarmanin,david@hotjar.com,Product analytics,Website analytics platform scaling globally
Spencer,Lanoue,Head of Growth,Hotjar,https://hotjar.com,SaaS / Analytics,Europe,100-500,https://www.linkedin.com/in/spencerlanoue,spencer@hotjar.com,Growth scaling,Growth leader managing user acquisition ops
Peep,Laja,Founder & CEO,Wynter,https://wynter.com,SaaS / Research,United States,10-50,https://www.linkedin.com/in/peeplaja,peep@wynter.com,B2B messaging,Message testing platform scaling research ops
Haris,Bacic,Co-Founder & CEO,Prismic,https://prismic.io,SaaS / CMS,Europe,50-200,https://www.linkedin.com/in/harisbacic,haris@prismic.io,Headless CMS,CMS platform scaling developer support
Ohad,Elhelo,Co-Founder & CEO,Entrio,https://entrio.io,SaaS / Events,Europe,10-50,https://www.linkedin.com/in/ohadelhelo,ohad@entrio.io,Event tech,Event management platform scaling event ops
Gaetano,DiNardi,VP of Growth,Aura,https://aura.com,SaaS / Security,United States,200-500,https://www.linkedin.com/in/gaetanodinardi,gaetano@aura.com,Identity protection,Consumer security platform scaling growth ops
Amanda,Natividad,VP of Marketing,SparkToro,https://sparktoro.com,SaaS / MarTech,United States,1-10,https://www.linkedin.com/in/amandanatividad,amanda@sparktoro.com,Audience research,Marketing research tool with lean team
Corey,Haines,Founder,SwipeWell,https://swipewell.app,SaaS / Marketing,United States,1-10,https://www.linkedin.com/in/coreyhainesco,corey@swipewell.app,Marketing tools,Ad swipe file tool with growing user base
Ross,Simmonds,Founder & CEO,Foundation Inc,https://foundationinc.co,B2B Marketing,Canada,10-50,https://www.linkedin.com/in/rosssimmonds,ross@foundationinc.co,Content marketing,B2B content agency scaling client operations
Benji,Hyam,Co-Founder,Grow and Convert,https://growandconvert.com,B2B Marketing,United States,10-50,https://www.linkedin.com/in/benjihyam,benji@growandconvert.com,Content strategy,Content marketing agency scaling production ops
Camille,Ricketts,Head of Content,Notion,https://notion.so,SaaS / Productivity,United States,500-1000,https://www.linkedin.com/in/camillericketts,camille@makenotion.com,Content ops,Managing content operations at productivity giant
Dave,Gerhardt,Founder & CEO,Exit Five,https://exitfive.com,B2B Community,United States,1-10,https://www.linkedin.com/in/davegerhardt,dave@exitfive.com,B2B community,Marketing community scaling membership ops
Chris,Savage,Co-Founder & CEO,Wistia,https://wistia.com,SaaS / Video,United States,100-500,https://www.linkedin.com/in/csavage,chris@wistia.com,Video platform,Business video platform scaling support ops
Brendan,Schwartz,Co-Founder & CTO,Wistia,https://wistia.com,SaaS / Video,United States,100-500,https://www.linkedin.com/in/brendanschwartz,brendan@wistia.com,Video infrastructure,CTO managing video hosting infrastructure
Dhiraj,Rajaram,Founder & CEO,Mu Sigma,https://mu-sigma.com,Analytics / Consulting,United States,1000+,https://www.linkedin.com/in/dhirajrajaram,dhiraj@mu-sigma.com,Analytics outsourcing,Analytics firm with massive operational teams
Matt,Mullenweg,Co-Founder & CEO,Automattic,https://automattic.com,SaaS / CMS,United States,1000+,https://www.linkedin.com/in/mattm,matt@automattic.com,WordPress empire,Fully distributed company powering 40% of web
Dries,Buytaert,Founder & CTO,Acquia,https://acquia.com,SaaS / CMS,United States,500-1000,https://www.linkedin.com/in/buytaert,dries@acquia.com,Drupal ecosystem,Open-source CMS platform scaling enterprise
Brian,Halligan,Co-Founder,HubSpot,https://hubspot.com,SaaS / CRM,United States,1000+,https://www.linkedin.com/in/brianhalligan,brian@hubspot.com,Inbound marketing,Pioneer of inbound marketing at massive scale
Katie,Burke,Chief People Officer,HubSpot,https://hubspot.com,SaaS / CRM,United States,1000+,https://www.linkedin.com/in/katieburke09,kburke@hubspot.com,People ops,CPO managing culture and hiring at scale
Nadia,Rawlinson,Chief People Officer,Slack,https://slack.com,SaaS / Comms,United States,1000+,https://www.linkedin.com/in/nadiarawlinson,nadia@slack.com,HR transformation,CPO managing distributed workforce scaling
Katelin,Holloway,VP of People,Reddit,https://reddit.com,Social / Community,United States,1000+,https://www.linkedin.com/in/katelinholloway,katelin@reddit.com,People scaling,VP People managing rapid community platform hiring
Colleen,McCreary,Chief People Officer,Credit Karma,https://creditkarma.com,FinTech,United States,1000+,https://www.linkedin.com/in/colleenmccreary,colleen@creditkarma.com,Fintech HR,CPO managing people ops at fintech scale
Nellie,Peshkov,VP of People,Figma,https://figma.com,SaaS / Design,United States,1000+,https://www.linkedin.com/in/nelliepeshkov,nellie@figma.com,Design culture,VP People scaling hiring at design platform
Gianna,Driver,Chief People Officer,Lattice,https://lattice.com,HR Tech,United States,500-1000,https://www.linkedin.com/in/giannadriver,gianna@lattice.com,HR Tech People,CPO at HR platform understands people ops deeply
Shannon,Ogborn,Head of People Ops,Lattice,https://lattice.com,HR Tech,United States,500-1000,https://www.linkedin.com/in/shannonogborn,shannon@lattice.com,People operations,Head of People Ops at leading HR tech company
Annie,Lin,VP of People,Lever,https://lever.co,HR Tech,United States,100-500,https://www.linkedin.com/in/annieclin,annie@lever.co,Recruiting tech,VP People at recruiting software company
Carin,Taylor,Chief Diversity Officer,Workday,https://workday.com,HR Tech / Enterprise,United States,1000+,https://www.linkedin.com/in/carintaylor,carin@workday.com,Enterprise HR,CDO managing diversity and inclusion at scale
Beth,Steinberg,VP of People & Talent,Chime,https://chime.com,FinTech,United States,500-1000,https://www.linkedin.com/in/bethsteinberg,beth@chime.com,Fintech hiring,VP managing talent acquisition at neobank
Stacy,Zapar,Head of Recruiting,Calendly,https://calendly.com,SaaS / Scheduling,United States,500-1000,https://www.linkedin.com/in/stacyzapar,stacy@calendly.com,Talent acquisition,Recruiting leader at scheduling platform
Mark,Levy,Head of Employee Experience,Airbnb,https://airbnb.com,Marketplace,United States,1000+,https://www.linkedin.com/in/marklevyux,mark@airbnb.com,EX innovation,Pioneer of employee experience design
Lars,Schmidt,Founder,Amplify,https://amplifytalent.com,HR Consulting,United States,10-50,https://www.linkedin.com/in/larsschmidt,lars@amplifytalent.com,HR innovation,HR thought leader advising scaling companies
Hung,Lee,Curator,Recruiting Brainfood,https://recruitingbrainfood.com,HR / Recruiting,United Kingdom,1-10,https://www.linkedin.com/in/hunglee,hung@recruitingbrainfood.com,Recruiting community,Leading recruiting newsletter curator globally
Nolan,Church,Co-Founder & CEO,Continuum,https://continuumhq.com,HR Tech,United States,10-50,https://www.linkedin.com/in/nolanchurch,nolan@continuumhq.com,Comp benchmarking,Former Carta CPO building compensation tool
Matt,Charney,Chief Content Officer,Recruiting Daily,https://recruitingdaily.com,HR Media,United States,10-50,https://www.linkedin.com/in/mattcharney,matt@recruitingdaily.com,HR content,Leading HR media platform content leader
Becky,Cantieri,Chief People Officer,SurveyMonkey,https://surveymonkey.com,SaaS,United States,500-1000,https://www.linkedin.com/in/beckycantieri,becky@surveymonkey.com,People strategy,CPO managing people ops at survey platform
Jessica,Hayes,VP of People,Whereby,https://whereby.com,SaaS / Video,Europe,50-200,https://www.linkedin.com/in/jessicahayes,jessica@whereby.com,Remote HR,VP People at fully remote video platform
Lexi,Reese,COO,Gusto,https://gusto.com,HR Tech / FinTech,United States,500-1000,https://www.linkedin.com/in/lexireese,lexi@gusto.com,Operations scaling,COO managing operational growth at payroll platform
Brian,Kropp,VP of HR Research,Gartner,https://gartner.com,Research / Consulting,United States,1000+,https://www.linkedin.com/in/briankropp,brian.kropp@gartner.com,HR research,VP researching HR trends at enterprise advisory
David,Green,Director of People Analytics,Insight222,https://insight222.com,HR Tech / Consulting,United Kingdom,10-50,https://www.linkedin.com/in/davidrgreen,david@insight222.com,People analytics,Leading expert on people analytics and HR data
Dawn,Klinghoffer,Head of People Analytics,Microsoft,https://microsoft.com,Technology,United States,1000+,https://www.linkedin.com/in/dawnklinghoffer,dawn@microsoft.com,People analytics,Head of people analytics at global tech giant
