Will,Allred,Co-Founder & COO,Lavender,https://lavender.ai,AI / Sales,United States,10-50,https://www.linkedin.com/in/willallred,will@lavender.ai,AI email coach,AI email coaching tool startup scaling fast
Chris,Fountain,CEO,Agency Savvy,https://agencysavvy.com,Agency / Consulting,United Kingdom,10-50,https://www.linkedin.com/in/chrisfountain,chris@agencysavvy.com,Agency ops,Agency operations consultancy scaling clients
Troy,Dean,Founder & CEO,Agency Mavericks,https://agencymavericks.com,Agency / Education,Australia,10-50,https://www.linkedin.com/in/troydean,troy@agencymavericks.com,Agency coaching,Agency coaching platform scaling membership ops
Pia,Silva,Founder,No BS Agency,https://nobsagencies.com,Agency / Consulting,United States,1-10,https://www.linkedin.com/in/piasilva,pia@nobsagencies.com,Agency branding,Branding agency consultant scaling client work
Marcel,Petitpas,CEO & Co-Founder,Parakeeto,https://parakeeto.com,SaaS / Agency,Canada,10-50,https://www.linkedin.com/in/marcelpetitpas,marcel@parakeeto.com,Agency profitability,Agency profitability tool needs ops support
Karl,Hughes,Founder & CEO,Draft.dev,https://draft.dev,Agency / Content,United States,10-50,https://www.linkedin.com/in/karlhughes,karl@draft.dev,Dev content,Technical content agency scaling writer ops
Tommy,Walker,Founder,The Content Studio,https://thecontentstudio.com,Agency / Content,United States,1-10,https://www.linkedin.com/in/tommyismyname,tommy@thecontentstudio.com,Content ops,Content strategy consultancy scaling production
Devin,Reed,Founder,The Reeder,https://daborea.com,Media / Sales,United States,1-10,https://www.linkedin.com/in/devinreed,devin@thereeder.com,Content creator,Sales content creator scaling newsletter ops
Chris,Do,Founder & CEO,The Futur,https://thefutur.com,Education / Design,United States,10-50,https://www.linkedin.com/in/thechrisdo,chris@thefutur.com,Design education,Design education company scaling course ops
Roberto,Blake,Founder & CEO,Create Awesome Media,https://robertoblake.com,Media / Education,United States,1-10,https://www.linkedin.com/in/robertoblake,roberto@robertoblake.com,Creator economy,Creator educator scaling content production ops
Sunny,Lenarduzzi,Founder & CEO,YouTube for Bosses,https://sunnylenarduzzi.com,Education / Video,Canada,10-50,https://www.linkedin.com/in/sunnylenarduzzi,sunny@sunnylenarduzzi.com,Video courses,Video course creator scaling student support ops
Greg,Isenberg,CEO,Late Checkout,https://latecheckout.com,Venture / Community,Canada,10-50,https://www.linkedin.com/in/gregisenberg,greg@latecheckout.com,Community building,Community holding company scaling portfolio ops
Codie,Sanchez,Founder & CEO,Contrarian Thinking,https://codiasanchez.com,Media / Investing,United States,10-50,https://www.linkedin.com/in/codiesanchez,codie@contrarianthinking.co,Boring businesses,Small business acquisition educator scaling ops
Danny,Iny,Founder & CEO,Mirasee,https://mirasee.com,Education / Coaching,Canada,50-200,https://www.linkedin.com/in/dannyiny,danny@mirasee.com,Course creation,Online course business scaling coaching ops
Stu,McLaren,Co-Founder,Searchie,https://searchie.io,SaaS / Education,Canada,10-50,https://www.linkedin.com/in/stumclaren,stu@searchie.io,Membership platform,Membership platform for creators scaling support
Gerard,Adams,Founder & CEO,Leaders Create Leaders,https://gerardadams.com,Education / Media,United States,10-50,https://www.linkedin.com/in/gerardadams,gerard@gerardadams.com,Millennial branding,Media company scaling content and event ops
Shaan,Hathiramani,CEO,Flockjay,https://flockjay.com,EdTech / Sales,United States,10-50,https://www.linkedin.com/in/shaanhathiramani,shaan@flockjay.com,Sales training,Sales training platform for diverse talent
Mike,McDerment,Co-Founder & CEO,FreshBooks,https://freshbooks.com,SaaS / Accounting,Canada,200-500,https://www.linkedin.com/in/mikemcderment,mike@freshbooks.com,SMB accounting,Cloud accounting for SMBs scaling customer support
Amir,Salihefendic,Founder & CEO,Doist,https://doist.com,SaaS / Productivity,Europe,50-200,https://www.linkedin.com/in/amirs,amir@doist.com,Remote-first,Todoist maker with fully remote team scaling ops
Chase,Buckner,VP of Marketing,GoHighLevel,https://gohighlevel.com,SaaS / Agency,United States,100-500,https://www.linkedin.com/in/chasebuckner,chase@gohighlevel.com,Agency SaaS,All-in-one agency platform scaling customer ops
Shaun,Clark,Co-Founder & CEO,GoHighLevel,https://gohighlevel.com,SaaS / Agency,United States,100-500,https://www.linkedin.com/in/shaunclark,shaun@gohighlevel.com,Agency platform,CEO managing fast-growing agency SaaS operations
Varun,Vairavan,Co-Founder,GoHighLevel,https://gohighlevel.com,SaaS / Agency,United States,100-500,https://www.linkedin.com/in/varunvairavan,varun@gohighlevel.com,Platform scaling,Co-founder managing platform infrastructure
Allan,Dib,Author & CEO,Successwise,https://successwise.com,Education / Marketing,Australia,10-50,https://www.linkedin.com/in/allandib,allan@successwise.com,Marketing plans,Marketing author scaling consulting operations
Russell,Brunson,Co-Founder & CEO,ClickFunnels,https://clickfunnels.com,SaaS / Marketing,United States,200-500,https://www.linkedin.com/in/russbrunson,russell@clickfunnels.com,Funnel empire,Marketing funnel platform scaling support ops
Todd,Dickerson,Co-Founder & CTO,ClickFunnels,https://clickfunnels.com,SaaS / Marketing,United States,200-500,https://www.linkedin.com/in/todddickerson,todd@clickfunnels.com,Tech scaling,CTO managing marketing platform infrastructure
Dean,Graziosi,Co-Founder,Mastermind.com,https://mastermind.com,Education / Events,United States,50-200,https://www.linkedin.com/in/deangraziosi,dean@mastermind.com,Course empire,Education entrepreneur scaling event operations
Pedro,Adao,Founder,100X Academy,https://pedroadao.com,Education / Coaching,United States,10-50,https://www.linkedin.com/in/pedroadao,pedro@pedroadao.com,Challenge launches,Challenge launch expert scaling coaching ops
Frank,Kern,Founder,Frank Kern Inc,https://frankkern.com,Agency / Marketing,United States,10-50,https://www.linkedin.com/in/frankkern,frank@frankkern.com,Direct response,Marketing legend scaling agency operations
Ryan,Deiss,Founder & CEO,DigitalMarketer,https://digitalmarketer.com,Education / Marketing,United States,50-200,https://www.linkedin.com/in/ryandeiss,ryan@digitalmarketer.com,Marketing education,Marketing education company scaling course ops
Roland,Frasier,Co-Founder,DigitalMarketer,https://digitalmarketer.com,Education / Marketing,United States,50-200,https://www.linkedin.com/in/rolandfrasier,roland@digitalmarketer.com,Business acquisition,Co-founder managing acquisition and scaling ops
Joanna,Wiebe,Founder,Copyhackers,https://copyhackers.com,Education / Copywriting,Canada,10-50,https://www.linkedin.com/in/joannawiebe,joanna@copyhackers.com,Copy education,Copywriting education scaling course operations
Val,Geisler,Founder,Fix My Churn,https://fixmychurn.com,SaaS Consulting,United States,1-10,https://www.linkedin.com/in/valgeisler,val@fixmychurn.com,Churn consulting,Email onboarding consultant needs ops support
Brian,Dean,Founder,Backlinko,https://backlinko.com,Education / SEO,United States,10-50,https://www.linkedin.com/in/brianedean,brian@backlinko.com,SEO education,SEO educator scaling content production ops
Tim,Soulo,CMO,Ahrefs,https://ahrefs.com,SaaS / SEO,Europe,100-500,https://www.linkedin.com/in/timsoulo,tim@ahrefs.com,SEO tools,CMO managing marketing at SEO tools platform
Dmitry,Gerasimenko,Founder & CEO,Ahrefs,https://ahrefs.com,SaaS / SEO,Europe,100-500,https://www.linkedin.com/in/dmitrygerasimenko,dmitry@ahrefs.com,Bootstrapped SaaS,Bootstrapped CEO managing global operations
Cyrus,Shepard,Founder,Zyppy,https://zyppy.com,SaaS / SEO,United States,1-10,https://www.linkedin.com/in/cyrusshepard,cyrus@zyppy.com,SEO consulting,SEO consultancy needs ops support to scale
Gael,Breton,Co-Founder,Authority Hacker,https://authorityhacker.com,Education / SEO,Europe,10-50,https://www.linkedin.com/in/gaelbreton,gael@authorityhacker.com,SEO courses,SEO education company scaling course operations
Spencer,Haws,Founder,Niche Pursuits,https://nichepursuits.com,Media / SEO,United States,1-10,https://www.linkedin.com/in/spencerhaws,spencer@nichepursuits.com,Niche sites,Niche site builder scaling content production
Jon,Morrow,Founder & CEO,Smart Blogger,https://smartblogger.com,Education / Content,United States,10-50,https://www.linkedin.com/in/jonmorrow,jon@smartblogger.com,Blogging education,Blogging education company scaling student ops
Syed,Balkhi,Founder & CEO,Awesome Motive,https://awesomemotive.com,SaaS / WordPress,United States,100-500,https://www.linkedin.com/in/syedbalkhi,syed@awesomemotive.com,WordPress empire,WordPress plugin empire scaling support ops
Ahmad,Awais,Founder,VSCode.pro,https://ahmadawais.com,Education / Dev Tools,United States,1-10,https://www.linkedin.com/in/mrahmadawais,ahmad@ahmadawais.com,Dev education,Developer educator scaling community ops
Natalie,Nagele,Co-Founder & CEO,Wildbit,https://wildbit.com,SaaS / Email,United States,10-50,https://www.linkedin.com/in/natalienagele,natalie@wildbit.com,Calm company,People-first company scaling email platform ops
Chris,Lema,VP of Products,Developer Tools,https://chrislema.com,SaaS / WordPress,United States,1-10,https://www.linkedin.com/in/chrislema,chris@chrislema.com,Product leadership,WordPress product leader and business advisor
Darrell,Vesterfelt,Founder,Good People Digital,https://darrellvesterfelt.com,Agency / Marketing,United States,10-50,https://www.linkedin.com/in/darrellvesterfelt,darrell@goodpeopledigital.com,Content agency,Digital marketing agency scaling client delivery
Kaleigh,Moore,Founder,Lumen Content,https://kaleighmoore.com,Agency / Content,United States,1-10,https://www.linkedin.com/in/kaleighmoore,kaleigh@kaleighmoore.com,E-com content,E-commerce content writer scaling client ops
Alli,Decker,Head of Content,Impossible Foods,https://impossiblefoods.com,Food Tech,United States,500-1000,https://www.linkedin.com/in/allidecker,alli@impossiblefoods.com,Food tech,Head of content managing comms at food tech
