First Name,Last Name,Title,Company Name,Company URL,Industry,Company Location,Company Size,LinkedIn Url,Email,Hiring Signal,Reason This Is a Strong Lead
Parker,Conrad,Founder & CEO,Rippling,https://rippling.com,HR Tech,United States,1000+,https://www.linkedin.com/in/parkerconrad,parker@rippling.com,Rapid expansion,Scaling aggressively across multiple product lines
Guillermo,Rauch,Founder & CEO,Vercel,https://vercel.com,Cloud / SaaS,United States,100-500,https://www.linkedin.com/in/rauchg,guillermo@vercel.com,Funding round,Rapid product adoption scaling support needs
Alex,Bouaziz,Co-Founder & CEO,Deel,https://deel.com,HR Tech,United States,500-1000,https://www.linkedin.com/in/alexbouaziz,alex@deel.com,Global expansion,Serving global teams requires 24/7 ops support
Mathilde,Collin,Co-Founder & CEO,Front,https://front.com,SaaS,United States,100-500,https://www.linkedin.com/in/mathildecollin,mathilde@front.com,Scaling comms,Workflow management company values operational efficiency
Jack,Altman,Co-Founder,Lattice,https://lattice.com,HR Tech,United States,500-1000,https://www.linkedin.com/in/jackaltman,jack@lattice.com,Massive scaling,Hypergrowth hits internal operational bottlenecks
Christina,Cacioppo,Co-Founder & CEO,Vanta,https://vanta.com,SaaS / Security,United States,100-500,https://www.linkedin.com/in/ccacioppo,christina@vanta.com,Explosive growth,Security compliance scaling requires operational manpower
Paul,Copplestone,Co-Founder & CEO,Supabase,https://supabase.com,Developer Tools,United States,50-200,https://www.linkedin.com/in/paulcopplestone,paul@supabase.com,Ecosystem scaling,Open-source traction creates support demands
Karri,Saarinen,Co-Founder & CEO,Linear,https://linear.app,SaaS / Productivity,United States,50-200,https://www.linkedin.com/in/karrisaarinen,karri@linear.app,Product-led growth,Lean org needs external ops support
Thomas,Paul Mann,Co-Founder & CEO,Raycast,https://raycast.com,SaaS / Productivity,United Kingdom,10-50,https://www.linkedin.com/in/thomaspaulmann,thomas@raycast.com,Series A Growth,Small team with massive user base
Peer,Richelsen,Co-Founder & Co-CEO,Cal.com,https://cal.com,SaaS,United States,10-50,https://www.linkedin.com/in/peerrichelsen,peer@cal.com,Market expansion,Needs operational scaffolding for B2B sales
Amjad,Masad,Founder & CEO,Replit,https://replit.com,Developer Tools,United States,100-500,https://www.linkedin.com/in/amjadmasad,amjad@replit.com,High user volume,Millions of signups need customer success ops
Edo,Liberty,Founder & CEO,Pinecone,https://pinecone.io,AI / Infrastructure,United States,50-200,https://www.linkedin.com/in/edoliberty,edo@pinecone.io,AI boom,AI infrastructure scaling needs ops execution
Harrison,Chase,Co-Founder & CEO,LangChain,https://langchain.com,AI,United States,10-50,https://www.linkedin.com/in/harrison-chase-961287118,harrison@langchain.dev,Massive inbound,Founders buried in partnership requests
Aravind,Srinivas,Co-Founder & CEO,Perplexity,https://perplexity.ai,AI / Search,United States,50-200,https://www.linkedin.com/in/aravind-srinivas-16051987,aravind@perplexity.ai,Exponential scaling,Fighting massive competitors requires ops outsourcing
Mati,Staniszewski,Co-Founder & CEO,ElevenLabs,https://elevenlabs.io,AI / Audio,United Kingdom,50-200,https://www.linkedin.com/in/matistaniszewski,mati@elevenlabs.io,Global scaling,Voice API needs 24/7 operational support pods
Andrew,Mason,Founder & CEO,Descript,https://descript.com,SaaS / Media,United States,100-500,https://www.linkedin.com/in/andrewmason,andrew@descript.com,Heavy investment,B2B sales scaling needs sales-ops offloads
Jaleh,Rezaei,Co-Founder & CEO,Mutiny,https://mutinyhq.com,SaaS / MarTech,United States,50-200,https://www.linkedin.com/in/jalehrezaei,jaleh@mutinyhq.com,Outbound motion,Martech needs vast SDR and ops support
Barry,McCardel,Co-Founder & CEO,Hex,https://hex.tech,Data Tech,United States,50-200,https://www.linkedin.com/in/barrymccardel,barry@hex.tech,Series B,Enterprise sales needs contract processing teams
Jennifer,Smith,Founder & CEO,Scribe,https://scribehow.com,SaaS / Productivity,United States,50-200,https://www.linkedin.com/in/jennifersmithscribe,jennifer@scribehow.com,Viral growth,Workflow tool company values outsourced ops
Victor,Riparbelli,Co-Founder & CEO,Synthesia,https://synthesia.io,AI / Video,United Kingdom,100-500,https://www.linkedin.com/in/victorriparbelli,victor@synthesia.io,EU expansion,AI rendering pipelines need operational support
Cristobal,Valenzuela,Co-Founder & CEO,Runway,https://runwayml.com,AI / Creative,United States,100-500,https://www.linkedin.com/in/cvalenzuela,cristobal@runwayml.com,Creative AI boom,Server scaling needs deep ops bandwidth
Clem,Delangue,Co-Founder & CEO,Hugging Face,https://huggingface.co,AI / OS,United States,100-500,https://www.linkedin.com/in/clemdelangue,clem@huggingface.co,Community ops,Largest AI platform needs global moderation
Immad,Akhund,Co-Founder & CEO,Mercury,https://mercury.com,FinTech,United States,500-1000,https://www.linkedin.com/in/immad,immad@mercury.com,Bank scaling,Fintech onboarding needs remote manpower
Spenser,Skates,Co-Founder & CEO,Amplitude,https://amplitude.com,SaaS / Analytics,United States,500-1000,https://www.linkedin.com/in/spenserskates,spenser@amplitude.com,Enterprise expansion,Account management needs vast resourcing
Tomer,London,Co-Founder & CEO,Gusto,https://gusto.com,HR Tech / FinTech,United States,500-1000,https://www.linkedin.com/in/tomerlondon,tomer@gusto.com,SMB expansion,Payroll platform scaling requires massive ops
Josh,Reeves,Co-Founder & CEO,Gusto,https://gusto.com,HR Tech / FinTech,United States,500-1000,https://www.linkedin.com/in/joshreeves,josh@gusto.com,SMB expansion,Co-founder managing rapid customer growth
Sanjay,Beri,Founder & CEO,Netskope,https://netskope.com,Cybersecurity,United States,500-1000,https://www.linkedin.com/in/sanjayberi,sanjay@netskope.com,Enterprise security,Cloud security scaling needs heavy support ops
Jay,Simons,CEO,Atlassian,https://atlassian.com,SaaS / Dev Tools,United States,1000+,https://www.linkedin.com/in/jaysimons,jay@atlassian.com,Global enterprise,Massive dev tool platform needs ops at scale
Ivan,Zhao,Co-Founder & CEO,Notion,https://notion.so,SaaS / Productivity,United States,500-1000,https://www.linkedin.com/in/ivanhzhao,ivan@makenotion.com,Explosive PLG,Productivity tool with millions of users needs support
Akshay,Kothari,COO,Notion,https://notion.so,SaaS / Productivity,United States,500-1000,https://www.linkedin.com/in/akothari,akshay@makenotion.com,Scaling ops,COO directly manages operational scaling
Vlad,Magdalin,Founder & CEO,Webflow,https://webflow.com,SaaS / No-Code,United States,500-1000,https://www.linkedin.com/in/vladmagdalin,vlad@webflow.com,No-code boom,Website builder scaling enterprise features
Bryant,Chou,Co-Founder & CTO,Webflow,https://webflow.com,SaaS / No-Code,United States,500-1000,https://www.linkedin.com/in/bryantchou,bryant@webflow.com,Tech scaling,CTO managing rapid infrastructure growth
Krish,Ramineni,Co-Founder & CEO,Fireflies.ai,https://fireflies.ai,AI / Productivity,United States,50-200,https://www.linkedin.com/in/krishramineni,krish@fireflies.ai,AI meeting tool,Meeting AI tool scaling needs support ops
Sam,Liang,Co-Founder & CEO,Otter.ai,https://otter.ai,AI / Productivity,United States,100-500,https://www.linkedin.com/in/samliangai,sam@otter.ai,Transcription boom,AI transcription platform needs ops teams
Eiso,Kant,Co-Founder & CEO,Athenian,https://athenian.com,Dev Tools,Europe,10-50,https://www.linkedin.com/in/eisokant,eiso@athenian.com,Engineering analytics,Dev analytics startup needs lean ops
Guillaume,Moubeche,Founder & CEO,Lemlist,https://lemlist.com,SaaS / Sales,Europe,50-200,https://www.linkedin.com/in/gmoubeche,guillaume@lemlist.com,Cold email growth,Sales outreach tool founder understands ops value
Thibaut,Davoult,Co-Founder,Lemlist,https://lemlist.com,SaaS / Sales,Europe,50-200,https://www.linkedin.com/in/thibautdavoult,thibaut@lemlist.com,Scaling sales,Outreach platform co-founder managing growth
Tope,Awotona,Founder & CEO,Calendly,https://calendly.com,SaaS / Scheduling,United States,500-1000,https://www.linkedin.com/in/topeawotona,tope@calendly.com,Enterprise push,Scheduling giant needs enterprise ops support
David,Cancel,CEO,Drift,https://drift.com,SaaS / MarTech,United States,500-1000,https://www.linkedin.com/in/dcancel,david@drift.com,Conversational AI,Chat platform scaling enterprise needs ops
Elias,Torres,Co-Founder & CTO,Drift,https://drift.com,SaaS / MarTech,United States,500-1000,https://www.linkedin.com/in/eliastorres,elias@drift.com,AI scaling,CTO managing conversational AI infrastructure
Dylan,Field,Co-Founder & CEO,Figma,https://figma.com,SaaS / Design,United States,1000+,https://www.linkedin.com/in/dylanfield,dylan@figma.com,Design tool dominance,Massive design platform needs global support ops
Evan,Wallace,Co-Founder,Figma,https://figma.com,SaaS / Design,United States,1000+,https://www.linkedin.com/in/evanwallace,evan@figma.com,Product scaling,Co-founder managing rapid product growth
Melanie,Perkins,Co-Founder & CEO,Canva,https://canva.com,SaaS / Design,Australia,1000+,https://www.linkedin.com/in/melanieperkins,melanie@canva.com,Global expansion,Design platform with massive global user base
Cliff,Obrecht,Co-Founder & COO,Canva,https://canva.com,SaaS / Design,Australia,1000+,https://www.linkedin.com/in/cliffobrecht,cliff@canva.com,Global ops,COO managing international operational scaling
Mikkel,Svane,Founder & CEO,Zendesk,https://zendesk.com,SaaS / CX,United States,1000+,https://www.linkedin.com/in/mikkelsvane,mikkel@zendesk.com,CX expansion,Customer experience platform at massive scale
Girish,Mathrubootham,Founder & CEO,Freshworks,https://freshworks.com,SaaS / CX,United States,1000+,https://www.linkedin.com/in/giaborea,girish@freshworks.com,CRM scaling,Business software suite with global ops
Shishir,Mehrotra,Founder & CEO,Coda,https://coda.io,SaaS / Productivity,United States,200-500,https://www.linkedin.com/in/shishirmehrotra,shishir@coda.io,Doc platform,All-in-one doc platform scaling enterprise
Emmet,Shear,Co-Founder,Twitch,https://twitch.tv,Social / Streaming,United States,1000+,https://www.linkedin.com/in/emmetshear,emmet@twitch.tv,Creator economy,Massive streaming platform needs ops infrastructure
Vlad,Tenev,Co-Founder & CEO,Robinhood,https://robinhood.com,FinTech,United States,1000+,https://www.linkedin.com/in/vladtenev,vlad@robinhood.com,Fintech growth,Trading app with millions of users needs support
Baiju,Bhatt,Co-Founder,Robinhood,https://robinhood.com,FinTech,United States,1000+,https://www.linkedin.com/in/baijubhatt,baiju@robinhood.com,Regulatory scaling,Fintech compliance needs operational teams
Max,Levchin,Founder & CEO,Affirm,https://affirm.com,FinTech,United States,1000+,https://www.linkedin.com/in/maxlevchin,max@affirm.com,BNPL expansion,Buy-now-pay-later scaling merchant ops
Henrique,Dubugras,Co-Founder & CEO,Brex,https://brex.com,FinTech,United States,500-1000,https://www.linkedin.com/in/henriquedubugras,henrique@brex.com,Startup finance,Corporate card company scaling SMB support
Pedro,Franceschi,Co-Founder & CTO,Brex,https://brex.com,FinTech,United States,500-1000,https://www.linkedin.com/in/pedrofranceschi,pedro@brex.com,Tech scaling,CTO scaling fintech infrastructure
Zach,Perret,Co-Founder & CEO,Plaid,https://plaid.com,FinTech,United States,500-1000,https://www.linkedin.com/in/zachperret,zach@plaid.com,API expansion,Financial API platform needs integration support
William,Hockey,Co-Founder,Plaid,https://plaid.com,FinTech,United States,500-1000,https://www.linkedin.com/in/williamhockey,william@plaid.com,Enterprise growth,Co-founder managing financial data partnerships
Nick,Mehta,CEO,Gainsight,https://gainsight.com,SaaS / CS,United States,500-1000,https://www.linkedin.com/in/nickmehta,nick@gainsight.com,CS platform,Customer success platform CEO understands ops
Bryan,Helmig,Co-Founder & CTO,Zapier,https://zapier.com,SaaS / Automation,United States,500-1000,https://www.linkedin.com/in/bryanhelmig,bryan@zapier.com,Automation boom,Workflow automation company values ops efficiency
Wade,Foster,Co-Founder & CEO,Zapier,https://zapier.com,SaaS / Automation,United States,500-1000,https://www.linkedin.com/in/wadefoster,wade@zapier.com,Remote-first scaling,Fully remote company needs distributed ops
Allan,Grant,Co-Founder & CEO,Tally,https://tally.so,SaaS / Forms,Europe,10-50,https://www.linkedin.com/in/allangrant,allan@tally.so,Product-led growth,Form builder with rapid adoption
Marie,Prokopets,Co-Founder & CEO,Nifty,https://niftypm.com,SaaS / PM,United States,10-50,https://www.linkedin.com/in/marieprokopets,marie@niftypm.com,PM tool growth,Project management tool scaling user base
Hiten,Shah,Co-Founder,FYI,https://usefyi.com,SaaS / Productivity,United States,10-50,https://www.linkedin.com/in/hitenshah,hiten@usefyi.com,Serial founder,Experienced SaaS founder values operational speed
Des,Traynor,Co-Founder & Chief Strategy,Intercom,https://intercom.com,SaaS / CX,United States,500-1000,https://www.linkedin.com/in/destraynor,des@intercom.com,AI customer support,Messaging platform scaling AI support ops
Eoghan,McCabe,Co-Founder & CEO,Intercom,https://intercom.com,SaaS / CX,United States,500-1000,https://www.linkedin.com/in/eoghanmccabe,eoghan@intercom.com,Enterprise expansion,CEO managing massive enterprise push
Calvin,French-Owen,Co-Founder & CTO,Segment,https://segment.com,SaaS / Data,United States,500-1000,https://www.linkedin.com/in/calvinfrenchowen,calvin@segment.com,Data infrastructure,Customer data platform needs integration ops
Peter,Reinhardt,Co-Founder & CEO,Segment,https://segment.com,SaaS / Data,United States,500-1000,https://www.linkedin.com/in/peterreinhardt,peter@segment.com,CDP scaling,Data platform founder managing growth
Dharmesh,Shah,Co-Founder & CTO,HubSpot,https://hubspot.com,SaaS / CRM,United States,1000+,https://www.linkedin.com/in/dharmesh,dharmesh@hubspot.com,SMB CRM dominance,Marketing automation at massive scale
Brian,Halligan,Co-Founder,HubSpot,https://hubspot.com,SaaS / CRM,United States,1000+,https://www.linkedin.com/in/brianhalligan,bhalligan@hubspot.com,Inbound movement,Pioneer of inbound marketing methodology
Neeraj,Agrawal,General Partner,Battery Ventures,https://battery.com,Venture Capital,United States,100-500,https://www.linkedin.com/in/neerajagrawal,neeraj@battery.com,Portfolio ops,VC firm portfolio companies need ops support
Pieter,Levels,Founder,Nomad List,https://nomadlist.com,SaaS / Remote,Europe,1-10,https://www.linkedin.com/in/levelsio,pieter@nomadlist.com,Solo founder scaling,Bootstrapped founder needs ops to scale without hiring
Sahil,Lavingia,Founder & CEO,Gumroad,https://gumroad.com,E-Commerce / SaaS,United States,10-50,https://www.linkedin.com/in/sahillavingia,sahil@gumroad.com,Creator economy,Creator commerce platform with lean team
Nathan,Barry,Founder & CEO,ConvertKit,https://convertkit.com,SaaS / Email,United States,50-200,https://www.linkedin.com/in/nathanbarry,nathan@convertkit.com,Creator tools,Email marketing platform scaling creator support
Patrick,Collison,Co-Founder & CEO,Stripe,https://stripe.com,FinTech,United States,1000+,https://www.linkedin.com/in/patrickcollison,patrick@stripe.com,Payments dominance,Global payments infrastructure at massive scale
John,Collison,Co-Founder & President,Stripe,https://stripe.com,FinTech,United States,1000+,https://www.linkedin.com/in/johncollison,john@stripe.com,Global expansion,Managing international operational scaling
Tobias,Lutke,Founder & CEO,Shopify,https://shopify.com,E-Commerce,Canada,1000+,https://www.linkedin.com/in/tobiaslutke,tobias@shopify.com,Commerce platform,E-commerce giant needs global merchant ops
Harley,Finkelstein,President,Shopify,https://shopify.com,E-Commerce,Canada,1000+,https://www.linkedin.com/in/harleyf,harley@shopify.com,Merchant expansion,President managing merchant operations at scale
Jason,Fried,Co-Founder & CEO,Basecamp,https://basecamp.com,SaaS / PM,United States,50-200,https://www.linkedin.com/in/jasonfried,jason@basecamp.com,Remote philosophy,Pioneer of remote work values lean ops
David,Heinemeier Hansson,Co-Founder & CTO,Basecamp,https://basecamp.com,SaaS / PM,United States,50-200,https://www.linkedin.com/in/davidheinemeierhansson,dhh@basecamp.com,Rails ecosystem,CTO managing tech infrastructure remotely
Stewart,Butterfield,Co-Founder,Slack,https://slack.com,SaaS / Comms,United States,1000+,https://www.linkedin.com/in/stewartbutterfield,stewart@slack.com,Enterprise comms,Workplace messaging at enterprise scale
Eric,Yuan,Founder & CEO,Zoom,https://zoom.us,SaaS / Video,United States,1000+,https://www.linkedin.com/in/ericsyuan,eric@zoom.us,Video platform,Video conferencing scaling global support
Sid,Sijbrandij,Co-Founder & CEO,GitLab,https://gitlab.com,Dev Tools,United States,1000+,https://www.linkedin.com/in/sijbrandij,sid@gitlab.com,All-remote pioneer,Fully remote dev platform with 1000+ employees
Nat,Friedman,Former CEO,GitHub,https://github.com,Dev Tools,United States,1000+,https://www.linkedin.com/in/natfriedman,nat@github.com,AI coding boom,Developer platform at massive global scale
Joel,Gascoigne,Co-Founder & CEO,Buffer,https://buffer.com,SaaS / Social,United States,50-200,https://www.linkedin.com/in/joelgascoigne,joel@buffer.com,Remote-first,Social media tool with fully remote team
Leo,Widrich,Co-Founder,Buffer,https://buffer.com,SaaS / Social,United States,50-200,https://www.linkedin.com/in/leowidrich,leo@buffer.com,Transparent culture,Co-founder at remote-first social tool
Rand,Fishkin,Co-Founder & CEO,SparkToro,https://sparktoro.com,SaaS / MarTech,United States,1-10,https://www.linkedin.com/in/randfishkin,rand@sparktoro.com,Audience research,Marketing research tool with tiny team
Patrick,Campbell,Founder,ProfitWell,https://profitwell.com,SaaS / Analytics,United States,100-500,https://www.linkedin.com/in/patrickccampbell,patrick@profitwell.com,Revenue analytics,SaaS metrics tool scaling B2B support
Ryan,Hoover,Founder,Product Hunt,https://producthunt.com,SaaS / Community,United States,50-200,https://www.linkedin.com/in/ryanhoover,ryan@producthunt.com,Launch platform,Product launch platform with global community
Brennan,Dunn,Founder,RightMessage,https://rightmessage.com,SaaS / Personalization,United States,1-10,https://www.linkedin.com/in/brennandunn,brennan@rightmessage.com,Solo scaling,Bootstrapped founder needs ops support
Rob,Walling,Co-Founder,TinySeed,https://tinyseed.com,Venture Capital,United States,10-50,https://www.linkedin.com/in/robwalling,rob@tinyseed.com,SaaS accelerator,Portfolio companies need operational support
Noah,Kagan,CEO,AppSumo,https://appsumo.com,E-Commerce / SaaS,United States,50-200,https://www.linkedin.com/in/noahkagan,noah@appsumo.com,Deal platform,Software deals platform scaling merchant ops
Oleg,Rogynskyy,Founder & CEO,People.ai,https://people.ai,AI / Sales,United States,100-500,https://www.linkedin.com/in/oleg-rogynskyy,oleg@people.ai,Revenue intelligence,AI sales platform needs ops support teams
Henry,Schuck,Founder & CEO,ZoomInfo,https://zoominfo.com,SaaS / Data,United States,1000+,https://www.linkedin.com/in/henryschuck,henry@zoominfo.com,Data platform,B2B contact data provider at massive scale
Kyle,Porter,Founder & CEO,SalesLoft,https://salesloft.com,SaaS / Sales,United States,500-1000,https://www.linkedin.com/in/kyleporter,kyle@salesloft.com,Sales engagement,Sales engagement platform scaling enterprise ops
Manny,Medina,Founder & CEO,Outreach,https://outreach.io,SaaS / Sales,United States,500-1000,https://www.linkedin.com/in/mannymedina,manny@outreach.io,Sales tech leader,Sales execution platform needs support teams
Nick,Loper,Founder,Side Hustle Nation,https://sidehustlenation.com,Media / Education,United States,1-10,https://www.linkedin.com/in/nickloper,nick@sidehustlenation.com,Creator scaling,Media entrepreneur needs ops support
Pat,Flynn,Founder,SPI Media,https://smartpassiveincome.com,Media / Education,United States,10-50,https://www.linkedin.com/in/patflynn,pat@smartpassiveincome.com,Content empire,Digital media company needs content ops
Amy,Porterfield,CEO,Amy Porterfield Inc,https://amyporterfield.com,Education / Marketing,United States,10-50,https://www.linkedin.com/in/amyporterfield,amy@amyporterfield.com,Course scaling,Online education business needs ops support
Tiago,Forte,Founder & CEO,Forte Labs,https://fortelabs.com,Education / Productivity,United States,10-50,https://www.linkedin.com/in/tiagoforte,tiago@fortelabs.com,BASB movement,Knowledge management educator scaling business
David,Perell,Founder,Write of Passage,https://writeofpassage.school,Education,United States,10-50,https://www.linkedin.com/in/davidperell,david@perell.com,Cohort education,Online writing school scaling cohorts
Ali,Abdaal,Founder & CEO,Ali Abdaal Ltd,https://aliabdaal.com,Education / Creator,United Kingdom,10-50,https://www.linkedin.com/in/aliabdaal,ali@aliabdaal.com,Creator scaling,Massive YouTube creator scaling business ops
Justin,Welsh,Founder,JW Strategic Advisory,https://justinwelsh.me,SaaS / Creator,United States,1-10,https://www.linkedin.com/in/justinwelsh,justin@justinwelsh.me,Solopreneur,LinkedIn thought leader needs ops support
Chris,Walker,Founder & CEO,Refine Labs,https://refinelabs.com,B2B Marketing,United States,50-200,https://www.linkedin.com/in/chriswalker171,chris@refinelabs.com,Demand gen,B2B demand gen agency scaling client ops
Sam,Parr,Co-Founder,Hampton,https://joinhampton.com,Community / Business,United States,10-50,https://www.linkedin.com/in/samparr,sam@joinhampton.com,CEO community,Founder community scaling membership ops
Shaan,Puri,Co-Host,My First Million,https://mfmpod.com,Media / Investing,United States,1-10,https://www.linkedin.com/in/shaanpuri,shaan@mfmpod.com,Media empire,Podcast entrepreneur with multiple ventures
George,Mack,Founder,Palladium Consulting,https://www.linkedin.com/in/georgemack212,Consulting / Marketing,United Kingdom,1-10,https://www.linkedin.com/in/georgemack212,george@palladium.co,Strategy consulting,Marketing strategist scaling client work
Alex,Hormozi,Founder & CEO,Acquisition.com,https://acquisition.com,Venture / Services,United States,50-200,https://www.linkedin.com/in/alexhormozi,alex@acquisition.com,Portfolio scaling,Business acquisition firm scaling portfolio ops
Leila,Hormozi,Co-Founder & CEO,Acquisition.com,https://acquisition.com,Venture / Services,United States,50-200,https://www.linkedin.com/in/leilahormozi,leila@acquisition.com,Brand building,Managing scaling operations across portfolio
Tom,Blomfield,Co-Founder,Monzo,https://monzo.com,FinTech,United Kingdom,1000+,https://www.linkedin.com/in/tomblomfield,tom@monzo.com,Neobank scaling,Digital bank scaling customer support globally
Anne,Boden,Founder & CEO,Starling Bank,https://starlingbank.com,FinTech,United Kingdom,500-1000,https://www.linkedin.com/in/anneboden,anne@starlingbank.com,Digital banking,UK neobank scaling operational support
Nikolay,Storonsky,Founder & CEO,Revolut,https://revolut.com,FinTech,United Kingdom,1000+,https://www.linkedin.com/in/nikolaystoronsky,nikolay@revolut.com,Global fintech,Super-app scaling global ops infrastructure
Taavet,Hinrikus,Co-Founder,Wise,https://wise.com,FinTech,United Kingdom,1000+,https://www.linkedin.com/in/taavethinrikus,taavet@wise.com,Money transfer,International transfers platform at massive scale
Kristo,Kaarmann,Co-Founder & CEO,Wise,https://wise.com,FinTech,United Kingdom,1000+,https://www.linkedin.com/in/kaarmankr,kristo@wise.com,Global payments,CEO managing global financial operations
Bernadette,Hyland,CEO,3 Round Stones,https://3roundstones.com,SaaS / Data,United States,10-50,https://www.linkedin.com/in/bernadettehyland,bernadette@3roundstones.com,Data management,Data management company needs ops support
Jean-Philippe,Courtois,EVP,Microsoft,https://microsoft.com,Technology,United States,1000+,https://www.linkedin.com/in/jeanphilippecourtois,jpcourtois@microsoft.com,Global enterprise,EVP managing massive global partnerships
Michael,Pryor,Co-Founder & Head of Product,Trello,https://trello.com,SaaS / PM,United States,100-500,https://www.linkedin.com/in/michaelpryor,michael@trello.com,PM tool scaling,Project management tool with massive user base
Joel,Spolsky,Co-Founder,Stack Overflow,https://stackoverflow.com,Dev Tools / Community,United States,500-1000,https://www.linkedin.com/in/joelspolsky,joel@stackoverflow.com,Dev community,Developer Q&A platform at massive global scale
Jeff,Lawson,Co-Founder & CEO,Twilio,https://twilio.com,SaaS / Communications,United States,1000+,https://www.linkedin.com/in/jeffiel,jeff@twilio.com,API platform,Communication APIs scaling global developer support
Dustin,Moskovitz,Co-Founder & CEO,Asana,https://asana.com,SaaS / PM,United States,1000+,https://www.linkedin.com/in/dustinmoskovitz,dustin@asana.com,Work management,Project management platform at enterprise scale
Justin,Rosenstein,Co-Founder,Asana,https://asana.com,SaaS / PM,United States,1000+,https://www.linkedin.com/in/justinrosenstein,justin@asana.com,Product vision,Co-founder managing product scaling
Eric,Ries,Author & Founder,LTSE,https://ltse.com,FinTech / Publishing,United States,50-200,https://www.linkedin.com/in/eries,eric@ltse.com,Lean startup,Long-term stock exchange founder needs ops
Steve,Blank,Founder & Author,Stanford,https://steveblank.com,Education / Consulting,United States,1-10,https://www.linkedin.com/in/steveblank,steve@steveblank.com,Startup education,Startup methodology pioneer with advisory work
Brian,Chesky,Co-Founder & CEO,Airbnb,https://airbnb.com,Marketplace,United States,1000+,https://www.linkedin.com/in/brianchesky,brian@airbnb.com,Travel marketplace,Global marketplace with massive host ops
Joe,Gebbia,Co-Founder,Airbnb,https://airbnb.com,Marketplace,United States,1000+,https://www.linkedin.com/in/jgebbia,joe@airbnb.com,Design thinking,Co-founder managing design and community
